title,link,publish_date,content
Sustainability is key in 2025 for businesses to advance AI efforts,https://www.artificialintelligence-news.com/news/sustainability-key-in-2025-businesses-advance-ai-efforts/,2025-02-04 14:44:43+00:00,"Since AI hit the mainstream in the last few years, industries across the world are feeling the positive impacts. From helping humanity to clean up our oceans to helping doctors to detect cancers earlier than ever before , AI’s potential and impact are growing by the day.

Regardless of whether this is being powered via a supercomputer, edge computing methods, or a traditional data centre, society is truly feeling the positive effect of advances in the AI industry.

However, with fresh innovation has always come questions around environmental impact. These concerns are gaining momentum, especially around the energy consumption associated with the increased processing power required to run increasingly large systems.

The United Nations Environment Programme recently expressed concerns about the rising levels of e-waste and cooling considerations for data centres more specifically. This also follows on from similar concerns from academia , who have flagged that a larger carbon footprint might be the price we are paying for innovation.

Add on top of this the fact that governments globally are implementing new regulations and reporting requirements as part of initiatives to curb the impact of climate change, such as the EU’s Circular Economy Action Plan (CEAP), and it becomes clear this issue is coming to the forefront of the AI agenda.

Analysts around the globe are also beginning to focus on this, with Gartner naming energy-efficient computing as a top technology trend for 2025 , as organisations come under pressure to show they are considering the impact AI is having on the environment.

Businesses that are not considering sustainability as part of core AI infrastructure and expansion or technology strategies are at risk of hindering their own progress. Failing to keep pace with sustainable practices can cause reputational damage, as organisations may be seen as behind the curve in an increasingly sustainability-focused world, alongside risking non-compliance with regulation.

When looking at the previously mentioned example of e-waste, if organisations are found to be not properly recycling devices (such as our Global Take Back Service ), they could face negative feedback and lose business as a result of poor brand image. With these factors in mind, it’s clear that businesses must consider building a sustainable AI framework that supports operational efficiency, encouraging business growth.

Prioritising the implementation of technologies that limit energy consumption can be a huge help when it comes to ensuring regulatory compliance and the ability to meet greater sustainability goals. These also come with the ability to help organisations to future-proof against market instability with reduced reliance on energy along with strengthening brand reputation in an increasingly environmentally-conscious world.

This is within easy reach for many businesses as there is a large number of offerings in the market that can balance sustainability efforts, with high processing capabilities. At ASUS we have partnered with Intel to provide servers that prioritise energy efficiency . There is so much available to businesses today if they choose to take the initial step and consider a strategy to implement technologies which balance regulatory pressures, customer expectations, and overall business goals will help organisations to feel confident innovation won’t come at a cost to the environment.

IDC has raised this with its audience, recently releasing predictions on the technology industry which outlined; “To address the environmental challenges of harnessing AI’s benefits, enterprises are turning to Sustainable AI Frameworks that focus on minimising the environmental impact of artificial intelligence by addressing key elements such as energy efficiency, resource optimisation, and e-waste reduction.”

As AI innovation continues to grow, alongside market pressure, businesses will find it becomes clear which organisations within the market are able to cope, and which will be left behind. Ultimately, those who choose to embed sustainability into AI strategies will lead the way.

(Photo by Angela Benito)

See also: French initiative for responsible AI leaders

Want to learn more about AI and big data from industry leaders? Check out AI & Big Data Expo taking place in Amsterdam, California, and London. The comprehensive event is co-located with other leading events including Intelligent Automation Conference, BlockX, Digital Transformation Week, and Cyber Security & Cloud Expo.

Explore other upcoming enterprise technology events and webinars powered by TechForge here."
Zebra Technologies and enterprise AI in the APAC,https://www.artificialintelligence-news.com/news/zebra-technologies-and-enterprise-ai-in-the-apac/,2025-02-04 14:43:12+00:00,"Enterprise AI transformation is reaching a tipping point. In the Asia Pacific, Zebra Technologies has unveiled ambitious plans to change frontline operations across the region. At a time when CISQ estimates poor software quality will cost US businesses $2.41 trillion in 2022, the push for practical, results-driven AI implementation is urgent.

“Elements of our three-pillar strategy have been around for quite some time, but what’s revolutionising the frontline today is intelligent automation,” Tom Bianculli, Chief Technology Officer at Zebra Technologies, told reporters at a briefing during Zebra’s 2025 Kickoff in Perth, Australia last week. “We’re not just digitising workflows – we’re connecting wearable technology with robotic workflows, enabling frontline workers to seamlessly interact with automation in ways that were impossible just five years ago.”

Practical applications driving change

The real-world impact of enterprise AI transformation is already evident in Zebra’s recent collaboration with a major North American retailer. The solution combines traditional AI with generative AI capabilities, enabling fast shelf analysis and automated task generation.

“You snap a picture of a shelf, [and] within one second, the traditional AI identifies all the products on the shelf, identifies where there’s missing product, maybe misplaced product… and then it makes that information available to a Gen AI agent that then decides what should you do,” Bianculli explains.

This level of automation has demonstrated significant operational improvements, reducing staffing requirements at the retailer by 25%. When it detects missing stock, the system automatically generates tasks for the right personnel, streamlining what was previously a multi-step manual process.

APAC leading AI adoption

The Asia Pacific region is emerging as a frontrunner in enterprise AI transformation. IBM research presented at the briefing indicates that 54% of APAC enterprises now expect AI to deliver longer-term innovation and revenue generation benefits. The region’s AI investment priorities for 2025 are clearly defined:

– 21% focused on enhancing customer experiences

– 18% directed toward business process automation

– 16% invested in sales automation and customer lifecycle management

Ryan Goh, Senior Vice President and General Manager of Asia Pacific at Zebra Technologies, points to practical implementations that are already driving results: “We have customers in e-commerce using ring scanners to scan packages, significantly improving their productivity compared to traditional scanning methods.”

Innovation at the edge

Zebra’s approach to AI deployment encompasses:

– AI devices with native neural architecture for on-device processing

– Multimodal experiences that mirror human cognitive capabilities

– Gen AI agents optimising workload distribution between edge and cloud

The company is advancing its activities in edge computing, with Bianculli revealing plans for on-device language models. This innovation mainly targets environments where internet connectivity is restricted or prohibited, ensuring AI capabilities remain accessible regardless of network conditions.

Regional market dynamics

The enterprise AI transformation journey varies significantly across APAC markets. India’s landscape is particularly dynamic, with the country’s GDP projected to grow 6.6% and manufacturing expected to surge by 7% YOY. Its commitment to AI is evident, with 96% of organisations surveyed by WEF actively running AI programmes.

Japan presents a different scenario, with 1.2% projected GDP growth and some unique challenges to automation adoption. “We used to think that tablets are for retail, but the Bay Area proved us wrong,” Goh notes, highlighting unexpected applications in manufacturing and customer self-service solutions.

Future trajectory

Gartner’s projections indicate that by 2027, 25% of CIOs will implement augmented connected workforce initiatives that will halve the time required for competency development. Zebra is already moving in this direction with its Z word companion, which uses generative AI and large language models and is scheduled for pilot deployment with select customers in Q2 of this year.

With a global presence spanning 120+ offices in 55 countries and 10,000+ channel partners across 185 countries, Zebra is positioned play strongly in the enterprise AI transformation across APAC. As the region moves from AI experimentation to full-scale deployment, the focus remains on delivering practical innovations that drive measurable business outcomes and operational efficiency.

(Photo by )

See also: Walmart and Amazon drive retail transformation with AI

Want to learn more about AI and big data from industry leaders? Check out AI & Big Data Expo taking place in Amsterdam, California, and London. The comprehensive event is co-located with other leading events including Intelligent Automation Conference, BlockX, Digital Transformation Week, and Cyber Security & Cloud Expo.

Explore other upcoming enterprise technology events and webinars powered by TechForge here"
French initiative for responsible AI leaders,https://www.artificialintelligence-news.com/news/french-initiative-for-responsible-ai-leaders/,2025-02-04 13:17:12+00:00,"ESSEC Business School and Accenture have announced the launch of a new initiative, ‘AI for Responsible Leadership,’ which marks the 10th anniversary of the establishment of the role of Chair at ESSEC, titled the ESSEC Accenture Strategic Business Analytics Chair.

The initiative aims to encourage the use of artificial intelligence by leaders in ways that are responsible and ethical, and that lead to high levels of professional performance. It aims to provide current and future leaders with the skills they require when faced with challenges in the future; economic, environmental, or social.

Several organisations support the initiative, including institutions, businesses, and specialised groups, including ESSEC Metalab for Data, Technology & Society, and Accenture Research.

Executive Director of the ESSEC Metalab, Abdelmounaim Derraz, spoke of the collaboration, saying, “Technical subjects are continuing to shake up business schools, and AI has opened up opportunities for collaboration between partner companies, researchers, and other members of the ecosystem (students, think tanks, associations, [and] public service).”

ESSEC and Accenture aim to integrate perspectives from multiple fields of expertise, an approach that is a result of experimentation in the decade the Chair has existed.

The elements of the initiative include workshops and talks designed to promote the exchange of knowledge and methods. It will also include a ‘barometer’ to help track AI’s implementation and overall impact on responsible leadership.

The initiative will engage with a network of institutions and academic publications, and an annual Grand Prix will recognise projects that focus on and explore the subject of AI and leadership.

Fabrice Marque, founder of the initiative and the current ESSEC Accenture Strategics Business Analytics Chair, said, “For years, we have explored the potential of using data and artificial intelligence in organisations. The synergies we have developed with our partners (Accenture, Accor, Dataiku, Engie, Eurofins, MSD, Orange) allowed us to evaluate and test innovative solutions before deploying them.

“With this initiative, we’re taking a major step: bringing together an engaged ecosystem to sustainably transform how leaders think, decide, and act in the face of tomorrow’s challenges. Our ambition is clear: to make AI a lever for performance, innovation and responsibility for […] leaders.”

Managing Director at Accenture and sponsor of the ESSEC/Accenture Chair and initiative, Aurélien Bouriot, said, “The ecosystem will benefit from the resources that Accenture puts at its disposal, and will also benefit our employees who participate.”

Laetitia Cailleteau, Managing Director at Accenture and leader of Responsible AI & Generative AI for Europe, highlighted the importance of future leaders understanding all aspects of AI.

“AI is a pillar of the ongoing industrial transformation. Tomorrow’s leaders must understand the technical, ethical, and human aspects and risks – and know how to manage them. In this way, they will be able to maximise value creation and generate a positive impact for the organisation, its stakeholders and society as a whole.”

Image credit: Wikimedia Commons

See also: Microsoft and OpenAI probe alleged data theft by DeepSeek

Want to learn more about AI and big data from industry leaders? Check out AI & Big Data Expo taking place in Amsterdam, California, and London. The comprehensive event is co-located with other leading events including Intelligent Automation Conference, BlockX, Digital Transformation Week, and Cyber Security & Cloud Expo.

Explore other upcoming enterprise technology events and webinars powered by TechForge here."
ChatGPT gains agentic capability for complex research,https://www.artificialintelligence-news.com/news/chatgpt-gains-agentic-capability-for-complex-research/,2025-02-03 17:22:06+00:00,"OpenAI is releasing a powerful agentic capability that enables ChatGPT to conduct complex, multi-step research tasks online. The feature, called Deep Research, reportedly achieves in tens of minutes what could take a human researcher hours or even days.

OpenAI describes Deep Research as a significant milestone in its journey toward artificial general intelligence (AGI).

“The ability to synthesise knowledge is a prerequisite for creating new knowledge,” says OpenAI. “For this reason, Deep Research marks a significant step toward our broader goal of developing AGI.”

Agentic AI enables ChatGPT to assist with complex research

Deep Research empowers ChatGPT to find, analyse, and synthesise information from hundreds of online sources autonomously. With just a prompt from the user, the tool can deliver a comprehensive report, comparable to the output of a research analyst, according to OpenAI.

Drawing capabilities from a variant of OpenAI’s upcoming “o3” model, the aim is to free users from time-consuming, labour-intensive information gathering. Whether it’s a competitive analysis of streaming platforms, an informed policy review, or even personalised recommendations for a new commuter bike, Deep Research promises precise and reliable results.

Importantly, every output includes full citations and transparent documentation—enabling users to verify the findings with ease.

The tool appears particularly adept at uncovering niche or non-intuitive insights, making it an invaluable asset across industries like finance, science, policymaking, and engineering. But OpenAI also envisions Deep Research being useful for the average user, such as shoppers looking for hyper-personalised recommendations or a specific product.

This latest agentic capability operates through the user interface of ChatGPT; users simply select the “Deep Research” option in the message composer and type their query. Supporting files or spreadsheets can also be uploaded for additional context.

Once initiated, the AI embarks on a rigorous multi-step process, which may take 5-30 minutes to complete. A sidebar provides updates on the actions taken and the sources consulted. Users can carry on with other tasks and will be notified when the final report is ready.

The results are presented in the chat as detailed, well-documented reports. In the coming weeks, OpenAI plans to enhance these outputs further by embedding images, data visualisations, and graphs to deliver even greater clarity and context.

Unlike GPT-4o – which excels in real-time, multimodal conversations – Deep Research prioritises depth and detail. Its ability to rigorously cite sources and provide comprehensive analysis sets it apart—shifting the focus from fast, summarised answers to well-documented, research-grade insights.

Built for real-world challenges

Deep Rsearch leverages sophisticated training methodologies, grounded in real-world browsing and reasoning tasks across diverse domains. Its model was trained via reinforcement learning to autonomously plan and execute multi-step research processes, including backtracking and adaptively refining its approach as new information becomes available.

The tool can browse user-uploaded files, generate and iterate on graphs using Python, embed media such as generated images and web pages into responses, and cite exact sentences or passages from its sources. The result of this extensive training is a highly capable agent for tackling complex real-world problems.

OpenAI evaluated Deep Research across a broad set of expert-level exams known as “Humanity’s Last Exam”. The exams – comprising over 3,000 questions covering topics from rocket science and linguistics to ecology and classics – test an AI’s competence in solving multifaceted problems.

The results were impressive, with the model achieving a record-breaking 26.6% accuracy across these domains:

GPT-4o: 3.3%

Grok-2: 3.8%

Claude 3.5 Sonnet: 4.3%

OpenAI o1: 9.1%

DeepSeek-R1: 9.4%

Deep research: 26.6% (with browsing + Python tools)

Deep Research also reached a new state-of-the-art performance on the GAIA benchmark, which evaluates AI models on real-world questions requiring reasoning, multi-modal fluency, and tool-use proficiency. Deep Research topped the leaderboard with a score of 72.57%.

Limitations and challenges

While the Deep Research agentic AI capability in ChatGPT signifies a bold step forward, OpenAI acknowledges that the technology is still in its early stages and comes with limitations.

The system occasionally “hallucinates” facts or offers incorrect inferences, albeit at a notably reduced rate compared to existing GPT models, according to OpenAI. It also faces challenges in differentiating between authoritative sources and speculative content, and it struggles to calibrate its confidence levels—often displaying undue certainty for potentially uncertain findings.

Minor formatting errors in reports and citations, as well as delays in initiating tasks, could also frustrate initial users. OpenAI says these issues are expected to improve over time with more usage and iterative refinements.

OpenAI is rolling out the capability gradually, starting with Pro users, who will have access to up to 100 queries per month. Plus and Team tiers will follow suit, with Enterprise access arriving next.

UK, Swiss, and European Economic Area residents are not yet able to access the feature, but OpenAI says it’s working on expanding its rollout to these regions.

In the weeks ahead, OpenAI will expand the feature to ChatGPT’s mobile and desktop platforms. The long-term vision includes enabling connections to subscription-based or proprietary data sources, further enhancing the robustness and personalisation of its outputs.

Looking further ahead, OpenAI envisions integrating Deep Research with “Operator,” an existing chatbot capability that takes real-world actions. This integration would allow ChatGPT to seamlessly handle tasks that require both asynchronous online research and real-world execution.

(Photo by John Schnobrich)

See also: Microsoft and OpenAI probe alleged data theft by DeepSeek

Want to learn more about AI and big data from industry leaders? Check out AI & Big Data Expo taking place in Amsterdam, California, and London. The comprehensive event is co-located with other leading events including Intelligent Automation Conference, BlockX, Digital Transformation Week, and Cyber Security & Cloud Expo.

Explore other upcoming enterprise technology events and webinars powered by TechForge here."
Qwen 2.5-Max outperforms DeepSeek V3 in some benchmarks,https://www.artificialintelligence-news.com/news/qwen-2-5-max-outperforms-deepseek-v3-some-benchmarks/,2025-01-29 10:03:48+00:00,"Alibaba’s response to DeepSeek is Qwen 2.5-Max, the company’s latest Mixture-of-Experts (MoE) large-scale model.

Qwen 2.5-Max boasts pretraining on over 20 trillion tokens and fine-tuning through cutting-edge techniques like Supervised Fine-Tuning (SFT) and Reinforcement Learning from Human Feedback (RLHF).

With the API now available through Alibaba Cloud and the model accessible for exploration via Qwen Chat, the Chinese tech giant is inviting developers and researchers to see its breakthroughs firsthand.

Outperforming peers

When comparing Qwen 2.5-Max’s performance against some of the most prominent AI models on a variety of benchmarks, the results are promising.

Evaluations included popular metrics like the MMLU-Pro for college-level problem-solving, LiveCodeBench for coding expertise, LiveBench for overall capabilities, and Arena-Hard for assessing models against human preferences.

According to Alibaba, “Qwen 2.5-Max outperforms DeepSeek V3 in benchmarks such as Arena-Hard, LiveBench, LiveCodeBench, and GPQA-Diamond, while also demonstrating competitive results in other assessments, including MMLU-Pro.”

The instruct model – designed for downstream tasks like chat and coding – competes directly with leading models such as GPT-4o, Claude-3.5-Sonnet, and DeepSeek V3. Among these, Qwen 2.5-Max managed to outperform rivals in several key areas.

Comparisons of base models also yielded promising outcomes. While proprietary models like GPT-4o and Claude-3.5-Sonnet remained out of reach due to access restrictions, Qwen 2.5-Max was assessed against leading public options such as DeepSeek V3, Llama-3.1-405B (the largest open-weight dense model), and Qwen2.5-72B. Again, Alibaba’s newcomer demonstrated exceptional performance across the board.

“Our base models have demonstrated significant advantages across most benchmarks,” Alibaba stated, “and we are optimistic that advancements in post-training techniques will elevate the next version of Qwen 2.5-Max to new heights.”

Making Qwen 2.5-Max accessible

To make the model more accessible to the global community, Alibaba has integrated Qwen 2.5-Max with its Qwen Chat platform, where users can interact directly with the model in various capacities—whether exploring its search capabilities or testing its understanding of complex queries.

For developers, the Qwen 2.5-Max API is now available through Alibaba Cloud under the model name “qwen-max-2025-01-25”. Interested users can get started by registering an Alibaba Cloud account, activating the Model Studio service, and generating an API key.

The API is even compatible with OpenAI’s ecosystem, making integration straightforward for existing projects and workflows. This compatibility lowers the barrier for those eager to test their applications with the model’s capabilities.

Alibaba has made a strong statement of intent with Qwen 2.5-Max. The company’s ongoing commitment to scaling AI models is not just about improving performance benchmarks but also about enhancing the fundamental thinking and reasoning abilities of these systems.

“The scaling of data and model size not only showcases advancements in model intelligence but also reflects our unwavering commitment to pioneering research,” Alibaba noted.

Looking ahead, the team aims to push the boundaries of reinforcement learning to foster even more advanced reasoning skills. This, they say, could enable their models to not only match but surpass human intelligence in solving intricate problems.

The implications for the industry could be profound. As scaling methods improve and Qwen models break new ground, we are likely to see further ripples across AI-driven fields globally that we’ve seen in recent weeks.

(Photo by Maico Amorim)

See also: ChatGPT Gov aims to modernise US government agencies

Want to learn more about AI and big data from industry leaders? Check out AI & Big Data Expo taking place in Amsterdam, California, and London. The comprehensive event is co-located with other leading events including Intelligent Automation Conference, BlockX, Digital Transformation Week, and Cyber Security & Cloud Expo.

Explore other upcoming enterprise technology events and webinars powered by TechForge here."
